{
  "account": 11556,
  "public_key_hex": "CA",
  "name": "newname",
  "type": 54321,
  "balance": "60000",
  "count_operations": 18,
  "block_last_updated": 18796,
  "state": "listed",
  "listing": {
    "block_locked_until": 0,
    "price": "10000000",
    "account_seller": 11557,
    "private_sale": false,
    "enc_pub_key_new": "000000000000"
  }
}